      -----------------------------------------------------------      
     |                   =====================                   |     
     |                           x T B                           |     
     |                   =====================                   |     
     |                         S. Grimme                         |     
     |          Mulliken Center for Theoretical Chemistry        |     
     |                    University of Bonn                     |     
      -----------------------------------------------------------      

   * xtb version 6.2.3 (830e466) compiled by 'ehlert@majestix' on 2020-03-16

   xtb is free software: you can redistribute it and/or modify it under
   the terms of the GNU Lesser General Public License as published by
   the Free Software Foundation, either version 3 of the License, or
   (at your option) any later version.
   
   xtb is distributed in the hope that it will be useful,
   but WITHOUT ANY WARRANTY; without even the implied warranty of
   MERCHANTABILITY or FITNESS FOR A PARTICULAR PURPOSE.  See the
   GNU Lesser General Public License for more details.
   
   Cite this work as:
   * S. Grimme, C. Bannwarth, P. Shushkov, J. Chem. Theory Comput., 2017,
     13, 1989-2009. DOI: 10.1021/acs.jctc.7b00118
   * C. Bannwarth, S. Ehlert and S. Grimme., J. Chem. Theory Comput., 2019,
     15, 1652-1671. DOI: 10.1021/acs.jctc.8b01176
   * P. Pracht, E. Caldeweyher, S. Ehlert, S. Grimme, ChemRxiv, 2019, preprint.
     DOI: 10.26434/chemrxiv.8326202.v1
   
   for DFT-D4:
   * E. Caldeweyher, C. Bannwarth and S. Grimme, J. Chem. Phys., 2017,
     147, 034112. DOI: 10.1063/1.4993215
   * E. Caldeweyher, S. Ehlert, A. Hansen, H. Neugebauer, S. Spicher,
     C. Bannwarth and S. Grimme, J. Chem. Phys., 2019, 150, 154122.
     DOI: 10.1063/1.5090222
   
   for sTDA-xTB:
   * S. Grimme and C. Bannwarth, J. Chem. Phys., 2016, 145, 054103.
     DOI: 10.1063/1.4959605
   
   in the mass-spec context:
   * V. Asgeirsson, C. Bauer and S. Grimme, Chem. Sci., 2017, 8, 4879.
     DOI: 10.1039/c7sc00601b
   
   for metadynamics refer to:
   * S. Grimme, J. Chem. Theory Comput., 2019, 155, 2847-2862
     DOI: 10.1021/acs.jctc.9b00143
   
   with help from (in alphabetical order)
   C. Bannwarth, F. Bohle, G. Brandenburg, E. Caldeweyher, M. Checinski,
   S. Dohm, S. Ehlert, S. Ehrlich, F. März, H. Neugebauer, J. Pisarek,
   P. Pracht, P. Shushkov, and S. Spicher.
   
 * started run on 2024/04/05 at 21:26:21.244     

           -------------------------------------------------
          |                Calculation Setup                |
           -------------------------------------------------

          command line arguments for : /home/ikalvet/software/xtb/6.2.3/bin/xtb
            ->   1 is file 'xtbtmp.xyz'
            ->   2 is flag --gbsa h2o
            ->   3 is flag -v
            ->   4 is flag --input None.xcontrol
          coordinate file            : xtbtmp.xyz
          xtbhome directory          : /home/woodbuse
          path for xtb               : /home/woodbuse
          xcontrol input file        : None.xcontrol
          omp threads                :                    20
          number of atoms            :                    86
          number of electrons        :                   248
          charge                     :                     1
          spin                       :                   0.0
          first test random number   :      0.41941250378734
          a pointer address          :            0x3ED6BD3C
          random memory content      :      3FDAD7A78AD33533

$$$$$$$$$$$$$$$$$$$$$$$$$$$$$$$$$$$$$$$$$$$$$$$$$$$$$$$$$$$$$$$$$$$$$$$$
 CONSTRAINTS & SCANS: DEBUG SECTION
$$$$$$$$$$$$$$$$$$$$$$$$$$$$$$$$$$$$$$$$$$$$$$$$$$$$$$$$$$$$$$$$$$$$$$$$
$$$$$$$$$$$$$$$$$$$$$$$$$$$$$$$$$$$$$$$$$$$$$$$$$$$$$$$$$$$$$$$$$$$$$$$$

molecular fragmentation (1/2 indicates fragments):
111111111111111111111111111111111111111111111222222222222222222221111111
11111111111111
# atoms in fragment 1/2:    66    20
 fragment masses (1/2) :      580.92      124.14
CMA distance (Bohr)    :   8.604
constraining FC (au)   :  0.0500
########################################################################
[WARNING] Please study the warnings concerning your input carefully
-2- prog_main: XTBPATH is not set, using XTBHOME instead
-1- prog_main: XTBHOME is not set, using HOME instead
########################################################################
           ------------------------------------------------- 
          |                 G F N 2 - x T B                 |
          | Geometry, Frequencies, Noncovalent interactions |
          |            JCTC 2019 parametrisation            |
           ------------------------------------------------- 
             k(s)              :                1.8500
             k(p)              :                2.2300
             k(d)              :                2.2300
             k(f)              :                2.0000
             kEN (H0ij)        :               -2.0000
             D4 a1             :                0.5200
             D4 a2             :                5.0000
             D4 s6             :                1.0000
             D4 s8             :                2.7000
             D4 s9             :                5.0000
             alphaj            :                2.0000

  Z AO/shell   Hii/eV     exponent
  1     Wed Apr 25 08:07:45 CEST 2018   EN: 2.200 GM2: 0.406  GM3: 0.0800  RAES: 1.40
     1s    -10.707211    1.230000
  6     Wed Apr 25 08:07:45 CEST 2018   EN: 2.550 GM2: 0.538  GM3: 0.1500  RAES: 3.00
     2s    -13.970922    2.096432
     2p    -10.063292    1.800000
  7     Wed Apr 25 08:07:45 CEST 2018   EN: 3.040 GM2: 0.461  GM3:-0.0640  RAES: 1.90
     2s    -16.686243    2.339881
     2p    -12.523956    2.014332
  8     Wed Apr 25 08:07:45 CEST 2018   EN: 3.440 GM2: 0.452  GM3:-0.0517  RAES: 1.80
     2s    -20.229985    2.439742
     2p    -15.503117    2.137023
 30     Wed Apr 25 13:34:15 CEST 2018   EN: 1.650 GM2: 0.564  GM3: 0.2313  RAES: 5.00
     4s     -7.177294    1.664847
     4p     -0.991895    1.176434

 Solvent             : h2o
 Using internal parameter file: .param_gbsa2_h2o
 Gsolv ref. state (COSMO-RS): gsolv [1 M gas/solution]
 temperature (mdtemp)       :    298.150000000000     
 dielectric constant        :    80.2000000000000     
 rho                        :    1.00000000000000     
 mass                       :    18.0000000000000     
 surface tension            :    15.5689454083859     
 probe radius               :   0.975313790000000     
 Gshift (Eh)                :   1.857443126794793E-003
 c1                         :    1.55243817000000     
 soset                      :   0.130326360000000     
 HB correction              :  T
           ------------------------------------------------- 
          |        Self-Consistent Charge Iterations        |
           ------------------------------------------------- 

          ...................................................
          :                      SETUP                      :
          :.................................................:
          :  # basis functions                 227          :
          :  # atomic orbitals                 227          :
          :  # shells                          133          :
          :  # electrons                       248          :
          :  max. iterations                   250          :
          :  Hamiltonian                  GFN2-xTB          :
          :  restarted?                      false          :
          :  GBSA solvation                   true          :
          :  PC potential                    false          :
          :  electronic temp.          300.0000000     K    :
          :  accuracy                    1.0000000          :
          :  -> integral cutoff          0.2500000E+02      :
          :  -> integral neglect         0.1000000E-07      :
          :  -> SCF convergence          0.1000000E-05 Eh   :
          :  -> wf. convergence          0.1000000E-03 e    :
          :  Broyden damping             0.4000000          :
          ...................................................

 iter      E             dE          RMSdq      gap      omega  full diag
   1   -142.0457825 -0.142046E+03  0.473E+00    2.97       0.0  T
   2   -142.3949202 -0.349138E+00  0.265E+00    2.51       1.0  T
   3   -142.4351482 -0.402280E-01  0.149E+00    2.55       1.0  T
   4   -142.4963630 -0.612147E-01  0.435E-01    2.43       1.0  T
   5   -142.5062125 -0.984955E-02  0.162E-01    2.51       1.0  T
   6   -142.5068241 -0.611620E-03  0.921E-02    2.50       1.0  T
   7   -142.5070372 -0.213048E-03  0.477E-02    2.52       1.0  T
   8   -142.5070394 -0.221116E-05  0.178E-02    2.51       1.0  T
   9   -142.5070576 -0.182027E-04  0.613E-03    2.51       1.8  T
  10   -142.5070582 -0.618095E-06  0.320E-03    2.51       3.4  T
  11   -142.5070584 -0.169473E-06  0.198E-03    2.51       5.5  T
  12   -142.5070585 -0.791144E-07  0.652E-04    2.51      16.5  T
  13   -142.5070585 -0.296839E-08  0.381E-04    2.51      28.3  T

   *** convergence criteria satisfied after 13 iterations ***

         #    Occupation            Energy/Eh            Energy/eV
      -------------------------------------------------------------
         1        2.0000           -0.7528199             -20.4853
       ...           ...                  ...                  ...
       118        2.0000           -0.4116985             -11.2029
       119        2.0000           -0.4048745             -11.0172
       120        2.0000           -0.4002889             -10.8924
       121        2.0000           -0.3985490             -10.8451
       122        2.0000           -0.3980991             -10.8328
       123        2.0000           -0.3963231             -10.7845
       124        2.0000           -0.3834960             -10.4355 (HOMO)
       125                         -0.2914196              -7.9299 (LUMO)
       126                         -0.2483338              -6.7575
       127                         -0.2458962              -6.6912
       128                         -0.2452163              -6.6727
       129                         -0.2429978              -6.6123
       ...                                ...                  ...
       227                          0.6647907              18.0899
      -------------------------------------------------------------
                  HL-Gap            0.0920764 Eh            2.5055 eV
             Fermi-level           -0.3374578 Eh           -9.1827 eV

 SCC (total)                   0 d,  0 h,  0 min,  0.421 sec
 SCC setup                      ...        0 min,  0.008 sec (  1.998%)
 Dispersion                     ...        0 min,  0.002 sec (  0.517%)
 integral evaluation            ...        0 min,  0.041 sec (  9.672%)
 zeroth order Hamiltonian       ...        0 min,  0.001 sec (  0.281%)
 iterations                     ...        0 min,  0.259 sec ( 61.546%)
 molecular gradient             ...        0 min,  0.109 sec ( 25.796%)
 printout                       ...        0 min,  0.001 sec (  0.178%)

         :::::::::::::::::::::::::::::::::::::::::::::::::::::
         ::                     SUMMARY                     ::
         :::::::::::::::::::::::::::::::::::::::::::::::::::::
         :: total energy            -140.786067189434 Eh    ::
         :: total w/o Gsasa/hb      -140.765883522001 Eh    ::
         :: gradient norm              0.083494693514 Eh/a0 ::
         :: HOMO-LUMO gap              2.505525877809 eV    ::
         ::.................................................::
         :: HOMO orbital eigv.       -10.435457986831 eV    ::
         :: LUMO orbital eigv.        -7.929932109021 eV    ::
         ::.................................................::
         :: SCC energy              -142.515476348194 Eh    ::
         :: -> isotropic ES            0.451069890707 Eh    ::
         :: -> anisotropic ES         -0.028662159103 Eh    ::
         :: -> anisotropic XC          0.050019183902 Eh    ::
         :: -> dispersion             -0.101508268224 Eh    ::
         :: -> Gsolv                  -0.139960471631 Eh    ::
         ::    -> Gborn               -0.119776804198 Eh    ::
         ::    -> Gsasa               -0.010275334837 Eh    ::
         ::    -> Ghb                 -0.011765775723 Eh    ::
         ::    -> Gshift               0.001857443127 Eh    ::
         :: repulsion energy           1.724897891728 Eh    ::
         :: add. restraining           0.000000000000 Eh    ::
         ::.................................................::
         :: atomisation energy        25.527260839186 Eh    ::
         :::::::::::::::::::::::::::::::::::::::::::::::::::::

           -------------------------------------------------
          |                Property Printout                |
           -------------------------------------------------

    * Orbital Energies and Occupations

         #    Occupation            Energy/Eh            Energy/eV
      -------------------------------------------------------------
         1        2.0000           -0.7528199             -20.4853
       ...           ...                  ...                  ...
       112        2.0000           -0.4257418             -11.5850
       113        2.0000           -0.4236091             -11.5270
       114        2.0000           -0.4219473             -11.4818
       115        2.0000           -0.4192127             -11.4074
       116        2.0000           -0.4183146             -11.3829
       117        2.0000           -0.4154674             -11.3054
       118        2.0000           -0.4116985             -11.2029
       119        2.0000           -0.4048745             -11.0172
       120        2.0000           -0.4002889             -10.8924
       121        2.0000           -0.3985490             -10.8451
       122        2.0000           -0.3980991             -10.8328
       123        2.0000           -0.3963231             -10.7845
       124        2.0000           -0.3834960             -10.4355 (HOMO)
       125                         -0.2914196              -7.9299 (LUMO)
       126                         -0.2483338              -6.7575
       127                         -0.2458962              -6.6912
       128                         -0.2452163              -6.6727
       129                         -0.2429978              -6.6123
       130                         -0.2421997              -6.5906
       131                         -0.2294620              -6.2440
       132                         -0.2237496              -6.0885
       133                         -0.2214624              -6.0263
       134                         -0.2154820              -5.8636
       135                         -0.2132498              -5.8028
       ...                                ...                  ...
       227                          0.6647907              18.0899
      -------------------------------------------------------------
                  HL-Gap            0.0920764 Eh            2.5055 eV
             Fermi-level           -0.3374578 Eh           -9.1827 eV

     #   Z        covCN         q      C6AA      α(0)
     1  30 Zn     2.956     0.248   122.257    21.599
     2   8 O      2.178    -0.494    22.713     6.437
     3   6 C      3.384     0.409    17.581     6.520
     4   8 O      0.856    -0.641    27.140     6.985
     5   8 O      1.705    -0.300    18.986     5.883
     6   1 H      0.802     0.344     0.603     1.220
     7   6 C      2.851     0.166    24.418     8.099
     8   6 C      2.910    -0.079    29.974     8.977
     9   6 C      2.907    -0.059    29.468     8.901
    10   6 C      2.867     0.145    24.844     8.170
    11   6 C      2.918    -0.034    28.851     8.808
    12   6 C      2.973    -0.020    28.502     8.757
    13   1 H      0.925     0.077     2.007     2.216
    14   1 H      0.926     0.087     1.910     2.161
    15   1 H      0.925     0.085     1.926     2.170
    16   6 C      3.804    -0.096    22.331     6.727
    17   1 H      0.924     0.067     2.117     2.275
    18   1 H      0.924     0.073     2.056     2.242
    19   7 N      2.655    -0.129    23.809     7.247
    20   6 C      3.040     0.075    26.291     8.410
    21   6 C      3.066     0.010    27.726     8.634
    22   6 C      2.989    -0.006    28.160     8.705
    23   7 N      2.810    -0.047    22.137     6.988
    24   1 H      0.926     0.113     1.670     2.021
    25   1 H      0.860     0.241     0.917     1.500
    26   1 H      0.926     0.095     1.831     2.116
    27   1 H      0.926     0.080     1.977     2.199
    28   7 N      2.673    -0.110    23.403     7.185
    29   6 C      3.036     0.073    26.334     8.417
    30   6 C      3.060     0.007    27.804     8.647
    31   6 C      2.988    -0.006    28.169     8.706
    32   7 N      2.811    -0.044    22.097     6.982
    33   1 H      0.926     0.121     1.605     1.981
    34   1 H      0.860     0.244     0.906     1.491
    35   1 H      0.926     0.099     1.797     2.096
    36   1 H      0.926     0.094     1.843     2.123
    37   7 N      2.668    -0.116    23.524     7.203
    38   6 C      3.041     0.074    26.315     8.414
    39   6 C      3.063     0.005    27.843     8.653
    40   6 C      2.990    -0.006    28.172     8.707
    41   7 N      2.810    -0.042    22.051     6.974
    42   1 H      0.926     0.117     1.638     2.001
    43   1 H      0.860     0.245     0.902     1.488
    44   1 H      0.926     0.102     1.763     2.077
    45   1 H      0.926     0.092     1.856     2.131
    46   8 O      1.651    -0.492    22.714     6.434
    47   1 H      0.802     0.319     0.668     1.284
    48   6 C      3.619     0.048    20.213     6.483
    49   1 H      0.923     0.028     2.612     2.527
    50   1 H      0.923     0.014     2.828     2.630
    51   1 H      0.924     0.038     2.477     2.461
    52   1 H      0.803     0.326     0.648     1.264
    53   8 O      1.652    -0.504    22.984     6.472
    54   6 C      3.620     0.045    20.261     6.491
    55   1 H      0.924     0.038     2.470     2.458
    56   1 H      0.924     0.032     2.555     2.500
    57   1 H      0.923     0.033     2.549     2.497
    58   1 H      0.800     0.364     0.557     1.173
    59   8 O      1.655    -0.402    20.880     6.168
    60   8 O      0.856    -0.463    22.973     6.426
    61   6 C      2.686     0.369    20.749     7.455
    62   6 C      3.751    -0.162    23.712     6.944
    63   1 H      0.924     0.098     1.803     2.100
    64   1 H      0.924     0.086     1.919     2.166
    65   1 H      0.924     0.102     1.771     2.081
    66   8 O      1.707    -0.263    18.365     5.786
    67   6 C      2.707     0.344    21.150     7.528
    68   8 O      0.857    -0.489    23.550     6.506
    69   6 C      2.904    -0.096    30.420     9.044
    70   1 H      0.925     0.066     2.126     2.280
    71   6 C      2.954     0.051    26.864     8.501
    72   6 C      3.754    -0.133    23.104     6.854
    73   1 H      0.924     0.091     1.868     2.138
    74   1 H      0.924     0.066     2.135     2.285
    75   1 H      0.924     0.081     1.969     2.194
    76   6 C      2.958     0.022    27.523     8.605
    77   6 C      2.914    -0.034    28.850     8.808
    78   6 C      2.916    -0.035    28.883     8.813
    79   6 C      2.910    -0.035    28.864     8.810
    80   6 C      2.910    -0.033    28.816     8.802
    81   6 C      2.911    -0.037    28.923     8.819
    82   1 H      0.925     0.022     2.701     2.570
    83   1 H      0.925     0.048     2.351     2.398
    84   1 H      0.925     0.024     2.667     2.554
    85   1 H      0.925     0.035     2.514     2.480
    86   1 H      0.925     0.027     2.624     2.533

 Mol. C6AA /au·bohr⁶  :      85182.479327
 Mol. C8AA /au·bohr⁸  :    2104516.477273
 Mol. α(0) /au        :        457.564539


Wiberg/Mayer (AO) data.
largest (>0.10) Wiberg bond orders for each atom
          total WBO             WBO to atom ...
     1  Zn  2.156        N   28 0.512    N   37 0.508    N   19 0.473    O    2 0.426
     2  O   2.227        H    6 0.825    C    3 0.589    Zn   1 0.426    O    4 0.102
     3  C   3.895        O    4 1.379    C   16 0.941    O    5 0.909    O    2 0.589
     4  O   1.778        C    3 1.379    O    2 0.102
     5  O   2.256        C    7 1.062    C    3 0.909
     6  H   0.881        O    2 0.825
     7  C   3.931        C    8 1.378    C    9 1.323    O    5 1.062
     8  C   3.979        C   10 1.386    C    7 1.378    H   13 0.962    C   11 0.102
     9  C   3.973        C   11 1.499    C    7 1.323    H   14 0.952
    10  C   3.913        C    8 1.386    C   12 1.282    O   66 1.047
    11  C   3.979        C    9 1.499    C   12 1.332    H   15 0.961    C    8 0.102
    12  C   3.983        C   11 1.332    C   10 1.282    C   71 1.153
    13  H   0.993        C    8 0.962
    14  H   0.992        C    9 0.952
    15  H   0.993        C   11 0.961
    16  C   3.989        C   76 1.009    H   17 0.959    H   18 0.959    C    3 0.941
    17  H   0.995        C   16 0.959
    18  H   0.994        C   16 0.959
    19  N   3.505        C   20 1.460    C   21 1.251    Zn   1 0.473
    20  C   3.953        N   19 1.460    N   23 1.344    H   24 0.946
    21  C   3.965        C   22 1.609    N   19 1.251    H   27 0.959
    22  C   3.947        C   21 1.609    N   23 1.225    H   26 0.963
    23  N   3.641        C   20 1.344    C   22 1.225    H   25 0.916
    24  H   0.987        C   20 0.946
    25  H   0.941        N   23 0.916
    26  H   0.990        C   22 0.963
    27  H   0.994        C   21 0.959
    28  N   3.539        C   29 1.454    C   30 1.247    Zn   1 0.512
    29  C   3.952        N   28 1.454    N   32 1.348    H   33 0.944
    30  C   3.961        C   31 1.611    N   28 1.247    H   36 0.957
    31  C   3.946        C   30 1.611    N   32 1.225    H   35 0.963
    32  N   3.644        C   29 1.348    C   31 1.225    H   34 0.915
    33  H   0.985        C   29 0.944
    34  H   0.940        N   32 0.915
    35  H   0.990        C   31 0.963
    36  H   0.991        C   30 0.957
    37  N   3.534        C   38 1.454    C   39 1.246    Zn   1 0.508
    38  C   3.954        N   37 1.454    N   41 1.350    H   42 0.945
    39  C   3.961        C   40 1.610    N   37 1.246    H   45 0.954
    40  C   3.945        C   39 1.610    N   41 1.225    H   44 0.962
    41  N   3.645        C   38 1.350    C   40 1.225    H   43 0.914
    42  H   0.986        C   38 0.945
    43  H   0.939        N   41 0.914
    44  H   0.989        C   40 0.962
    45  H   0.991        C   39 0.954
    46  O   1.916        C   48 1.012    H   47 0.827
    47  H   0.898        O   46 0.827
    48  C   3.962        O   46 1.012    H   51 0.985    H   49 0.980    H   50 0.979
    49  H   0.999        C   48 0.980
    50  H   1.000        C   48 0.979
    51  H   0.998        C   48 0.985
    52  H   0.894        O   53 0.835
    53  O   1.913        C   54 1.006    H   52 0.835
    54  C   3.955        O   53 1.006    H   55 0.986    H   56 0.979    H   57 0.978
    55  H   0.998        C   54 0.986
    56  H   0.999        C   54 0.979
    57  H   0.999        C   54 0.978
    58  H   0.867        O   59 0.776
    59  O   2.195        C   61 1.176    H   58 0.776    O   60 0.168
    60  O   2.008        C   61 1.684    O   59 0.168
    61  C   3.908        O   60 1.684    O   59 1.176    C   62 1.014
    62  C   3.984        C   61 1.014    H   64 0.978    H   63 0.967    H   65 0.940
    63  H   0.990        C   62 0.967
    64  H   0.993        C   62 0.978
    65  H   0.990        C   62 0.940
    66  O   2.361        C   10 1.047    C   67 1.028    O   68 0.133
    67  C   3.908        O   68 1.646    C   69 1.132    O   66 1.028
    68  O   1.950        C   67 1.646    O   66 0.133
    69  C   3.973        C   71 1.629    C   67 1.132    H   70 0.963
    70  H   0.995        C   69 0.963
    71  C   3.976        C   69 1.629    C   12 1.153    C   72 1.040
    72  C   3.988        C   71 1.040    H   74 0.982    H   75 0.957    H   73 0.956
    73  H   0.989        C   72 0.956
    74  H   0.995        C   72 0.982
    75  H   0.991        C   72 0.957
    76  C   3.986        C   78 1.416    C   77 1.406    C   16 1.009    C   81 0.110
    77  C   3.991        C   79 1.450    C   76 1.406    H   82 0.971    C   80 0.111
    78  C   3.989        C   80 1.438    C   76 1.416    H   83 0.968    C   79 0.111
    79  C   3.991        C   77 1.450    C   81 1.432    H   84 0.972    C   78 0.111
    80  C   3.991        C   81 1.443    C   78 1.438    H   85 0.971    C   77 0.111
    81  C   3.991        C   80 1.443    C   79 1.432    H   86 0.972    C   76 0.110
    82  H   0.999        C   77 0.971
    83  H   0.998        C   78 0.968
    84  H   0.999        C   79 0.972
    85  H   0.998        C   80 0.971
    86  H   0.999        C   81 0.972

molecular dipole:
                 x           y           z       tot (Debye)
 q only:       -8.586      -0.832      -6.152
   full:       -8.600      -0.727      -5.866      26.524
molecular quadrupole (traceless):
                xx          xy          yy          xz          yz          zz
 q only:      -23.829      -8.010      72.887     -30.311     -18.927     -49.058
  q+dip:      -25.119      -8.977      71.309     -26.938     -16.991     -46.190
   full:      -20.208      -7.875      68.866     -24.640     -18.528     -48.658


           -------------------------------------------------
          | TOTAL ENERGY             -140.786067189434 Eh   |
          | GRADIENT NORM               0.083494693514 Eh/α |
          | HOMO-LUMO GAP               2.505525877809 eV   |
           -------------------------------------------------

------------------------------------------------------------------------
 unit  open   action     filename
  129 false : read       None.xcontrol
  130 false : read       xtbtmp.xyz
  131 false : read       None.xcontrol
  132 false : written    charges
  133 false : written    wbo
  134 false : written    xtbrestart

------------------------------------------------------------------------
 * finished run on 2024/04/05 at 21:26:21.748     
------------------------------------------------------------------------
 total:
 * wall-time:     0 d,  0 h,  0 min,  0.503 sec
 *  cpu-time:     0 d,  0 h,  0 min,  6.076 sec
 * ratio c/w:    12.070 speedup
 SCF:
 * wall-time:     0 d,  0 h,  0 min,  0.422 sec
 *  cpu-time:     0 d,  0 h,  0 min,  5.325 sec
 * ratio c/w:    12.618 speedup

